Black_Robed_Traveler,,,,,,,,
request_turnips_mana_neutral,"Magical turnips? Well I suppose this won't make anything worse! *Thank you, my dear, and I'm sure Dante would thank you too if he knew I was going to 'improve' his wares.",,,,,,,
request_turnips_mana_good,"Magical turnips? How creative!*Wait, what will this even do to those darn vegetables?*Oh well, thank you, my dear, and I'm sure Dante would thank you too if he knew I was going to 'improve' his wares for him!",,,,,,,
,,,,,,,,
request_turnips_null_bad,"My dear, I don't think this brew will do much of anything to the turnips. *I don't feel much magical energy coming off of it.",,,,,,,
request_turnips_null_neutral,"My dear, I don't think this brew will do much of anything to the turnips. *I don't feel much magical energy coming off of it.",,,,,,,
request_turnips_null_good,"My dear, I don't think this brew will do much of anything to the turnips. *I don't feel much magical energy coming off of it.",,,,,,,
,,,,,,,,
request_turnips_poison_bad,My dear! We don't want to hurt the locals!*I don't know why I even bothered coming to you for something like this.*Thus far you've done nothing to help the people of this town.*Your aunt would be very disapointed. ,,,,,,,
request_turnips_poison_neutral,My dear! We don't want to hurt the locals!*I don't see what good poisioning these extra turnips will do for the town.*I hope you think through your actions more carefully next time.,,,,,,,
request_turnips_poison_good,"My dear! I don't see how poisioning the turnips will help!*This is very dangerous, my dear,*I hope you think through your actions more carefully next time.",,,,,,,
,,,,,,,,
request_turnips_sleep_bad,"-yawn- you plan to make the turnips... sleepy?*Well, I suppose everyone who buys them will get a few good night's sleep. *This certainly isn't the worst prank you've pulled, my dear. ",,,,,,,
request_turnips_sleep_neutral,"-yawn- you plan to make the turnips... sleepy?*Well, I suppose everyone who buys them will get a few good night's sleep! *This might just be helpful, my dear.",,,,,,,
request_turnips_sleep_good,"-yawn- you plan to make the turnips... sleepy?*Well, I suppose everyone who buys them will get a few good night's sleep! *This is a powerful potion, my dear, but perhaps a little misplaced.",,,,,,,
,,,,,,,,
request_turnips_speed_bad,"Whoa! My dear! These turnips will increase the productivity of the town tenfold! *I feel like going for a run just from tasting this brew! *Thanks my dear, this will actually be a help to the town for a change.",,,,,,,
request_turnips_speed_neutral,"Whoa! My dear! These turnips of speed will increase the productivity of the town tenfold! *I already feel like going for a run just from tasting this brew!*Thanks my dear, this will be a great help to the people of the town.",,,,,,,
request_turnips_speed_good,"Whoa! These turnips of speed will increase the productivity of the town tenfold! *I'm sure Dante would be greatful if he knew I was about to improve his wares. *Thank you, my dear, you've done your town a great service.",,,,,,,
,,,,,,,,
request_turnips_transformation_bad,Amazing! Transform the turnips into something more useful!*Let's give it a try - I brought one of the darn things with me ...*...*Incredible! It transformed into a pumpkin!*This will certainly solve the problem for sure!,,,,,,,
request_turnips_transformation_neutral,Amazing! Transform the turnips into something more useful!*Let's give it a try - I brought one of the darn things with me ...*...*Incredible! It transformed into a tomato!*This will certainly solve the problem for sure!,,,,,,,
request_turnips_transformation_good,Amazing! Transform the turnips into something more useful!*Let's give it a try - I brought one of the darn things with me ...*...*Incredible! It transformed into a golden goblet!*This will certainly solve the problem for sure!,,,,,,,
,,,,,,,,
default,default text for receiving stuff. This shouldn't ever be shown.,,,,,,,
,,,,,,,,
wait,"Of course, of course, I will be back tomorrow at the same time. Good evening.",,,,,,,
no,"Too bad, my dear.",,,,,,,
@,,,,,,,,
request_assess,1,-.3,.6,0,-1,.3,.3,-.4
request_turnips,.5,-.3,.2,0,-1,-.1,.3,1
,,,,,,,,
\White_Robed_Traveler,,,,,,,,
white_robed_traveler,,,,,,,,
white_robed_traveler,,,,,,,,
@,,,,,,,,
intro,"You there, young witch, so new to the ways of the world*You wish to grow your power, yes? I think I may be of help in that quest.*I have no name, young witch, but do not fear, the spirits of nature will make your path forward clear.",,,,,,,
overworld_night_full_bad,,,,,,,,
overworld_night_full_neutral,,,,,,,,
overworld_night_full_good,,,,,,,,
,,,,,,,,
request_transform_bad,"You there, young witch, so dead inside, do you want another chance to be allied?*Bring me a potion, nice and neat, that for me will be a special treat.*Make it change the drinker so, an animal form it might bestow.",,,,,,,
request_transform_neutral,"You there, young witch, training to be strong, want to join in on my drinking song?*Bring me a potion, nice and neat, that for me will be a special treat.*Make it change the drinker so, and animal form it might bestow.",,,,,,,
request_transform_good,"You there, young witch, a friend of earth, would you kindly prove your worth?*Bring me a potion, nice and neat, that for me will be a special treat.*Make it change the drinker so, an animal form it might bestow.",,,,,,,
,,,,,,,,
request_transform_healing_bad,"Ahh, you could not decode my riddle, eh? *We forest spirits work in a mysterious way... *This is still a nice drink, and it's nice to see, that I love of the earth could still set you free.",,,,,,,
request_transform_healing_neutral,"Ahh, you could not decode my riddle, eh? *We forest spirits work in a mysterious way... *This may not be the brew I cherish, but it's certianly one I think is fairish!",,,,,,,
request_transform_healing_good,"Ahh, you could not decode my riddle, eh?*we forest spirits work in a mysterious way...*You are so close to being one with nature, but perhaps you must put in a little more labor.",,,,,,,
request_transform_invisibility_bad,"Hehe, a little animal they might be, if dogs or mice were as invisible as me!*It's not quite right, but that's okay, this sort of brew will still please the fey.",,,,,,,
request_transform_invisibility_neutral,"Hehe, a little animal they might be, if dogs or mice were as invisible as me!*It's not quite right, but that's okay, this sort of brew will still please the fey.",,,,,,,
request_transform_invisibility_good,"Hehe, a little animal they might be, if dogs or mice were as invisible as me!*It's not quite right, but that's okay, this sort of brew will still please the fey.",,,,,,,
request_transform_mana_bad,"You there, young witch, so dead inside, do you want another chance to be allied?*Bring me a potion, nice and neat, that for me will be a special treat.*Make it change the drinker so, an animal form it might bestow.",,,,,,,
request_transform_mana_neutral,"Ahh, young witch, you give me mana! Such power will cause a ruckus with the fauna!*You ever give a deer the power of flight?*I did once and now it helps deliver presents at night!",,,,,,,
request_transform_mana_good,"Ahh, young witch, you give me mana! Such power will cause a ruckus with the fauna!*You ever give a deer the power of flight?*I did once and now it helps deliver presents at night!",,,,,,,
request_transform_null_bad,"Oh no, this isn't a potion at all, you've actually made something quite banal.*Try again and this time heed, something in common your ingredients all need.",,,,,,,
request_transform_null_neutral,"Oh no, this isn't a potion at all, you've actually made something quite banal.*Try again and this time heed, something in common your ingredients all need.",,,,,,,
request_transform_null_good,"Oh no, this isn't a potion at all, you've actually made something quite banal.*Try again and this time heed, something in common your ingredients all need.",,,,,,,
request_transform_poison_bad,"Ack, and evil potion you have made! Though much talent you've displayed!*Be a friend of nature, I advise, and do not listen to evil's lies.",,,,,,,
request_transform_poison_neutral,"Ack, and evil potion you have made! Though much talent you've displayed!*Be a friend of nature, I advise, and do not listen to evil's lies.",,,,,,,
request_transform_poison_good,"Ack, and evil potion you have made! Though much talent you've displayed!*Be a friend of nature, I advise, and do not listen to evil's lies.",,,,,,,
request_transform_sleep_bad,"Ahh, this is a potion I do not want to keep, as all it makes me want is sleep.*I want to run free in the wild, not end up quiet and mild.",,,,,,,
request_transform_sleep_neutral,"Ahh, this is a potion I do not want to keep, as all it makes me want is sleep.*I want to run free in the wild, not end up quiet and mild.",,,,,,,
request_transform_sleep_good,"Ahh, this is a potion I do not want to keep, as all it makes me want is sleep.*I want to run free in the wild, not end up quiet and mild.",,,,,,,
request_transform_speed_bad,"This potion will make all who drink go quick, not become a beast in forest thick*Did you listen to my riddle before? If so you should maybe listen more...*I know I speak in a strange way, but help me and I may help you someday.",,,,,,,
request_transform_speed_neutral,"This potion will make all who drink go quick, not become a beast in forest thick*Did you listen to my riddle before? If so you should maybe listen more...*I know I speak in a strange way, but help me and I may help you someday.",,,,,,,
request_transform_speed_good,"This potion will make all who drink go quick, not become a beast in forest thick*Did you listen to my riddle before? If so you should maybe listen more...*I know I speak in a strange way, but help me and I may help you someday.",,,,,,,
request_transform_transform_bad,"very good, you have proven yourself worthy of some sage advice.*Nature is a fearsome place. It is neither good nor bad, it merely acts for itself...*But, alas! Helping others is often in one's best interests, and makes the world a kinder place.",,,,,,,
request_transform_transform_neutral,"very good, you have proven yourself worthy of some sage advice.*Nature is a fearsome place. It is neither good nor bad, it merely acts for itself...*But, alas! Helping others is often in one's best interests, and makes the world a kinder place.",,,,,,,
request_transform_transform_good,"very good, you have proven yourself worthy of some sage advice.*Nature is a fearsome place. It is neither good nor bad, it merely acts for itself...*But, alas! Helping others is often in one's best interests, and makes the world a kinder place.",,,,,,,
default,default text for receiving stuff.,,,,,,,
wait,You have a day to decide your fate...,,,,,,,
no,"Very well, I'll leave for now, but I'll be back again sometime, I vow",,,,,,,
@,,,,,,,,
request_transform,.2,.5,.2,0,-.3,-.3,.2,1
,,,,,,,,
\Bernadette,,,,,,,,
bernie,,,,,,,,
bernie,,,,,,,,
@,,,,,,,,
intro,"Hi there. Have you seen, Geoff? No? Good. *Sorry, I suppose I should introduced myself. I'm Bernadette. But you can call me Bernie.*I'm supposed to be married soon but...I just don't think I'm ready.*I am trying to stay away from my fiancee so I can think think through.",,,,,,,
overworld_afternoon_waxhalf_forest_bad,"Leave me alone, witch, I don't need anything from you right now",What? Leave me alone.*I'm trying to avoid people right now.,,,,,,
overworld_afternoon_waxhalf_forest_neutral,"Hey there, nice day isn't it?*Oh, don't mind me, I'm just out here avoiding Geoff for a bit.","Oh, hey, I'm just out for a walk...*Don't mind me.",,,,,,
overworld_afternoon_waxhalf_forest_good,Hey! Are you out gathering ingredients?*I'm out here avoiding Geoff... I just can't deal with that stress right now.,"Hey, I was kind of hoping I'd run into you today.*I could use some advice, I like Geoff, you know? but I don't 'like' like Geoff...*He's perfectly nice, and treats me well, but I don't think he's 'the one'.*Is 'the one' even real? Or is that something people just made up to make them feel less sad?*Oh well, thanks for letting me get that off my chest.",,,,,,
overworld_evening_full_campsite_bad,"Ugh, what are you doing here?*You are NOT invited to bonfire night, witch.",,,,,,,
overworld_evening_full_campsite_neutral,"We try to get together each week to hang out without the old folks.*Nothing against 'em, it's just fun to be kids again sometimes.*You could join us sometime, I guess.","Oh hey, out enjoying the full moon too?*Bonfires are so nice on chilly nights like this.","Geoff honey, will you pass me another beer?",,,,,
overworld_evening_full_campsite_good,Ohmygosh hey! Come on over!*How's your week been? You been busy?*Want to play truth or dare with us?,,,,,,,
,,,,,,,,
request_hide_bad,"I don't know why I'm being so silly, I should be crazy about Geoff. I just....I think I could use a bit of me time, you know?*I know you don't like me very much, but maybe you can put yourself in my shoes as a woman?*Do you think you have anything that could help me out?",,,,,,,
request_hide_neutral,"I don't know why I'm being so silly, I should be crazy about Geoff. I just....I think I could use a bit of me time, you know?*Do you think you have anything that could help me out?",,,,,,,
request_hide_good,You always seem so happy. I wonder what your secret is. maybe you can help me with figuring out who I am for a little. Do you have a potion that could help give me space?,,,,,,,
,,,,,,,,
request_hide_healing_bad,"This is digusting. Tastes like spinach and kale.*I feel healthy, I guess. But that doesn't help out my situation.*Thanks for nothing, jerk.",,,,,,,
request_hide_healing_neutral,This is digusting. Tastes like spinach and kale.*I don't feel any different though.*Are you sure you gave me the right one?,,,,,,,
request_hide_healing_good,"This tastes like yoga and dieting*I don't really know how this is good for my situation, but I guess enough of them could help me lose weight.*I'll keep them in mind for the future.",,,,,,,
,,,,,,,,
request_hide_invisibility_bad,"My hands! Where did they go!?*Oh hey, that must've been an invisibility potion.*Not what I had in mind, but this'll work.*Thanks, I guess.",,,,,,,
request_hide_invisibility_neutral,"My hands! Where did they go!?*Oh hey, that must've been an invisibility potion.*Now I can walk around unnoticed and Geoff can't find me. Thank you.",,,,,,,
request_hide_invisibility_good,"My hands! Where did they go!?*I didn't know that was possible! I have to go how Amara, she'll get a kick out of this.*This will give me the time away I wanted. Thank you!!",,,,,,,
,,,,,,,,
request_hide_mana_bad,"What's this? It tastes like responsibility. Gross.*I feel...brave...huh*I'm going to go tell Geoff I want to delay the wedding.*Thanks, I guess.",,,,,,,
request_hide_mana_neutral,This makes me feel....brave. Weird.*I feel like I should go talk to Geoff about us.*Maybe I was wrong about you. Thanks for helping me out.,,,,,,,
request_hide_mana_good,Tastes like....responsibility. Huh. Weird.*I'm feeling like I could do anything. I'm going to go talk to Geoff. Thank you so much!,,,,,,,
,,,,,,,,
request_hide_null_bad,This is delicious!*...did it do anything? I can't tell*You were supposed to help me solve my problem!,,,,,,,
request_hide_null_neutral,"This is so delicious!*But I don't feel any different...*It was super good though, maybe I'll just buy it from you for the taste later.",,,,,,,
request_hide_null_good,What is this heaven beverage!?! Holy crap that's amazing!!!*Did it work? What did it do? I guess there's only one way to find out really,,,,,,,
,,,,,,,,
request_hide_poison_bad,....ugh*I don't feel so well...*I wonder if Geoff will still love me if I'm hurling all over.,,,,,,,
request_hide_poison_neutral,"....ugh*I feel like I'm going to barf!*Hey, I guess that's pretty useful actually. I can't get married if I'm sick.*Thanks, I guess.",,,,,,,
request_hide_poison_good,"....ugh*I, um...I don't feel very well.*On the upside I guess I can't get married if I'm throwing up*So...thanks?",,,,,,,
,,,,,,,,
request_hide_sleep_bad,"Tastes like lavender and nighty nighty time*I'm going to go pass out for a few hours.... maybe days?*Can't get married if I'm unconcious, I guess.",,,,,,,
request_hide_sleep_neutral,Tastes like lavender and dreams*I'm going to go pass out for a few hours.... maybe days?*Can't get married if I'm unconcious.,,,,,,,
request_hide_sleep_good,Tastes like lavender and the moon*I'm feeling really tired....think I'll take a nap.*Don't wake me up.*You're a doll. Night night.,,,,,,,
,,,,,,,,
request_hide_speed_bad,!!!*What was in that?!*I feel like I just drank ten cups of coffee!!*I'm gonna go run or something.,,,,,,,
request_hide_speed_neutral,"!!!*What was in that?!*My skin feels like it's on fire. But like, a good fire.*!!!!*I'm gonna go run to Antarctica. See you later!",,,,,,,
request_hide_speed_good,!!!*What was in that?!*I'm feeling like I could fly or run a million miles an hour.*I'm gonna go for a quick sprint around the continent. Geoff won't be able to catch me.*You're the best!,,,,,,,
,,,,,,,,
request_hide_transformation_bad,".....?*Squak*I'm...a swan?*Well, Geoff never was very fond of animals, so I guess this works.*Squak",,,,,,,
request_hide_transformation_neutral,".....?*Squak*I'm...a swan?*At least I don't have to worry about the humidity and my hair*Squak*Marrying animals is illegal here too, so that's a plus.*Thank you! Squak.",,,,,,,
request_hide_transformation_good,.....?*Squak*I'm...a swan?*Squak*I always wanted to fly!*You're a genius!,,,,,,,
,,,,,,,,
default,default text for receiving stuff. This shouldn't ever be shown.,,,,,,,
wait,"come back later?*Okay, I guess I can",,,,,,,
no,"You can't help? Fine, I guess.",,,,,,,
@,,,,,,,,
request_hide,-.2,.6,.6,-.1,1,.1,.3,1
,,,,,,,,
,,,,,,,,
\Amara,,,,,,,,
Amara,,,,,,,,
Amara,,,,,,,,
@,,,,,,,,
intro,"HEY YOU! I HAVE A QUESTION!!*...So sorry about the yelling. I have a bad habit of that. Name's Amara, I run the tavern in town. Most of the time I have to yell to be heard over the drunk patrons.",,,,,,,
overworld_afternoon_waxcres_meadow_bad,"Keep your spells away from me, witch!*I have a busy day and I don't have time to get turned invisible or whatever.","Leave me alone, witch!*I don't need your tricks today!",,,,,,
overworld_afternoon_waxcres_meadow_neutral,I'm picking flowers for the tables at the inn.*It adds a lot of charm to have fresh flowers on the table!,Aren't the flowers out here beautiful?*It's always so nice to come out here to clear my head...,,,,,,
overworld_afternoon_waxcres_meadow_good,"I always pick up a few extra flowers for Bernie when I'm out.*I like to leave them on Bernie's porch as a nice suprise.*She's always so stressed out about everything, I hope they make her day brighter.","Nice day today, right?*Do you have any fun plans this week?","I might come by later this week for a brew, your potions are always wonderful.*Whenever I have a problem, I know you'll help me with it!*You're a good friend, you know.",,,,,
overworld_evening_waxcres_meadow_bad,"Keep your spells away from me, witch!*I have a busy day and I don't have time to get turned invisible or whatever.","Leave me alone, witch!*I don't need your tricks today!",,,,,,
overworld_evening_waxcres_meadow_neutral,I'm picking flowers for the tables at the inn.*It adds a lot of charm to have fresh flowers on the table!,Aren't the flowers out here beautiful?*It's always so nice to come out here to clear my head...,"It's getting late, I guess I should go home soon.*There aren't any monsters or anything out here, right?*Ralphie was telling all about this... horrible thing he said he saw the other day...*I bet he was lying.",,,,,
overworld_evening_waxcres_meadow_good,"I always pick up a few extra flowers for Bernie when I'm out.*I like to leave them on Bernie's porch as a nice suprise.*She's always so stressed out about everything, I hope they make her day brighter.","Nice day today, right?*Do you have any fun plans this week?","It's getting late, I guess I should go home soon.*There aren't any monsters or anything out here, right?*Ralphie was telling all about this... horrible thing he said he saw the other day...*I bet he was lying.","I've heard that some flowers only bloom at night, but I've never stayed out late enough to check*Do you think that's true? It sounds like an old wive's tale to me.",,,,
overworld_evening_full_campsite_bad,"Ugh, are you here to curse us?*Come on, let us have a night of fun.","This is public land, witch, we have the right to be here.*Leave us alone!",,,,,,
overworld_evening_full_campsite_neutral,"Hey girl, want to join in on the fun?*Well, we're just drinking beer.*Honestly there isn't much fun in this backwoods town for people our age.","I may work at a tavern, but it's way more fun to have a beer out here!*Want to join?",,,,,,
overworld_evening_full_campsite_good,Do you know any fun ghost stories you could tell us?*We've had to listen to the same one from Geoff about a tall man without a face over and over and over again.*I think it's the only one he knows...,,,,,,,
overworld_night_full_campsite_bad,"Ugh (hic), are you here to curse us?*Come on (hic), let us have a night of fun.","(hic) Don't start trouble, witch!*I'll fight you off if I have to!*I'm not (hic) afraid of you!",,,,,,
overworld_night_full_campsite_neutral,"(hic)I don't get the chance to drink at the tavern, I'm always too busy (hic) working*I like coming out here to unwind, howling at the moon makes me feel alive!*AWOOOOooo!",,,,,,,
overworld_night_full_campsite_good,"(hic) Bernie's so pretty, I wish I could have her hair, you know?*Not like, on my head, I just want to touch it all the time.*(hic) her soft, pretty hair...","(hic) Don't tell anyone but I steal stuff from people who get too drunk at my tavern*(hic) they usually break stuff anyways...*I don't keep any of it, of course (hic)*Most of it is pretty jewelry and stuff...*I give it all to Bernie.",,,,,,
,,,,,,,,
request_chill_bad,"HEY, WITCH-GIRL!*I know you dont like me much, but maybe we could put our differences aside for a good cause?*A friend of mine is getting married and it has been stressing me  out. I want to be supportive and all that, but I'm too highstrung about the whole thing.*Maybe you could whip me up something?",,,,,,,
request_chill_neutral,YOU'RE THE MAGIC CHICK RIGHT?*...A friend of mine is getting married and has been stressed out lately. I want to give her something to calm her nerves.*Maybe you could whip me up something to help her out?,,,,,,,
request_chill_good,"HEY, HUN!*I've been impressed with your work. Maybe you can help a lass out? My best girl, Bernie is getting married soon.*I've been mad stressed lately about it. As much as I don't think her beau is the best fit, I want her to be happy and I want to be happy for her.*Maybe you could whip me up something to chill out?",,,,,,,
,,,,,,,,
request_chill_healing_bad,"This is...so...*....good....*Wow. Hello. I feel like I'm waking up from a 20 year sleep.*This is amazing, thank you so much...maybe I misjudged you. ",,,,,,,
request_chill_healing_neutral,This is...so...*....good....*I feel like my breath has wings...that probably doesn't make any sense. I don't know how to describe it...*I guess I just feel at ease. Thank you very much.,,,,,,,
request_chill_healing_good,"This is...so...*....good....*Are the walls in here breathing? No? I guess that's just me. I feel so relaxed.*I knew your were good at your job, but, wow. Thank you.",,,,,,,
,,,,,,,,
request_chill_invisibility_bad,....?*MY HAND! WHAT HAVE YOU DONE!?*EVIL WITCH!!,,,,,,,
request_chill_invisibility_neutral,....?*Um...What's happening?*MY BODY!!*WHAT HAVE YOU DONE!?!,,,,,,,
request_chill_invisibility_good,"....?*WHAT IN THE...!?*HAVE YOU MADE ME INVISIBLE???*...Sorry, I shouldn't yell. I just, I don't know how this is supposed to help.*But I trust you, I guess. Maybe you're sending me on like a spirit quest or something.*Okay, Let's see what this strange new world holds...",,,,,,,
,,,,,,,,
request_chill_mana_bad,"What is this? It tastes so strange.*I feel like a calculator. Did you mess with my brain?*I'm not exactly relaxed, but this isn't the worst feeling ever.",,,,,,,
request_chill_mana_neutral,"What is this? It tastes so strange.*I feel like I could sit down and really focus on something. Did you mess with my brain?*This isn't really the sensation I was looking for relaxed, but this isn't the worst feeling ever.",,,,,,,
request_chill_mana_good,"This tastes like...calculus.*I want to just sit down and work out blueprints, see patterns in the movements of birds.*This is not really a relaxed feeling, but it's not too bad either.",,,,,,,
,,,,,,,,
request_chill_null_bad,...wow! This is so delicious!!!*I may have misjudged you. I feel as if a cloud is being lifted from my mind already.*What is this stuff called?*Placebo? Never heard of it.,,,,,,,
request_chill_null_neutral,...wow! This is amazing!!!*I feel as if a cloud is being lifted from my mind already.*What is this stuff called?*Placebo? Never heard of it.,,,,,,,
request_chill_null_good,This might be the tastiest drink I've ever had.*I feel...calm.*This stuff is a miracle. I might have to get your recipe so I can add it to the menu at the bar.*What's this called?*Placebo? Never heard of it.,,,,,,,
,,,,,,,,
request_chill_poison_bad,This...ack*I have to go. I'm gonna hurl!!,,,,,,,
request_chill_poison_neutral,I....*Do you have a garbage? I think I'm gonna be sick...*I have to go.,,,,,,,
request_chill_poison_good,I...umm...*I know you're smart but...I think you may have mixed something wrong.*I'm gonna throw up....I have to go.,,,,,,,
,,,,,,,,
request_chill_sleep_bad,WHAT IS THIS?*I...I feel so tired all of the sudden...,,,,,,,
request_chill_sleep_neutral,THIS TASTES AMAZING.*WHAT'S....IN...*....it*...sleepy,,,,,,,
request_chill_sleep_good,I feel...*....tired...*what's in this...?*I have to lay down.,,,,,,,
,,,,,,,,
