Black_Robed_Traveler,,,,,,,,
request_franklinworried_healing_good,"Mmm....Ahhh...Yeah miss your potions always seem to do the trick.*I reckon I was makin' my back sore from stress.*Ya ever find you get all tense when you're worryin' about somethin'? That sorta thing ain't healthy.*I reckon it's important to get up an' stretch every once in a while, but it seems like one of ya healing potions does the trick as well. Thank ya, miss.*...*Bein' honest though I think I'm mostly stressed about little Bernie's wedding.*It ain't that I'm worried about marryin' off my little girl or anythin'. Sure, I love her more than anythin',*but I know someday she gotta grow up and spread her wings.*More though I'm worried about her bein' happy. She's got real cold feet goin' in to this engagement with Geoff.*I reckon she feels like she should marry him outta obligation, an' I don't want her to end up bein' less than she could be...*Anyways thanks for listenin', and thanks again for the potion my friend.",,,,,,,
,,,,,,,,
request_franklinworried_invisibility_bad,Um....Miss I reckon you just turned me invisible.*This ain't exactly what I had in mind.*Any ideas how long this is gonna last? I want to talk to Bernie later without scarin' the peaches outta her.,,,,,,,
request_franklinworried_invisibility_neutral,"Um....Miss I reckon you just turned me invisible.*Did ya forget what I was askin for again? Ya know there's no shame in askin' me to repeat myself.*I sure hope this wears off soon, I was hoping to talk to Bernie later without scarin' the beans outta her.",,,,,,,
request_franklinworried_invisibility_good,"Um....I reckon you just turned me invisible.*I guess mistakes happen in all professions, though I figure ya should be a little more careful.*Now, are ya at all sure about how long this here condition is gonna last?*I want to talk to Bernie later without scarin' the beans outta her.",,,,,,,
,,,,,,,,
request_franklinworried_mana_bad,"Whoa, miss. What is this here concoction?*...It's great! I'm feelin' so much more confident about my situation. It's gonna be alright, I'm thinkin'.*I got enough money to get by for a while. Bernie gettin' married off is gonna help too, Geoff's family is pretty well off.",,,,,,,
request_franklinworried_mana_neutral,"Whoa, miss. What is this here concoction?*...It's great! I'm feelin' so much more confident about my situation. It's gonna be alright, I'm thinkin'.*I got enough money to get by for a while. Bernie gettin' married off is gonna help too, Geoff's family is pretty well off.*Thanks, miss, I reckon I'll be back soon.",,,,,,,
request_franklinworried_mana_good,"Whoa, miss, I feel great! What is this brew?*Huh, you say it's m-a-n-a? Never heard of that before.*No matter, I reckon things are gonna be alright. See, I didn't want to tell ya before,*But I've been more worried about little Bernie as of late rather than the money.*I'm worried she might be rushin' into things with Geoff. It's not like I'm worryin' about my little girl gettin' married or anythin', she gotta grow up sometime,*I'm just worried about her bein' happy, and I'm worried that the boy might not be the right one for her.*Don' tell anyone, but I reckon she's just with him 'cause he's the only other young bachelor in town...*Well, that's just my feelin' anyways. Listen, this brew has me feelin' awful confident.*I think I'm gonna go talk to her and see whats on her mind. Thanks, friend.",,,,,,,
,,,,,,,,
request_franklinworried_null_bad,Ya say this'll help?*...Hmmm... when ya think it'll kick in?*...well I reckon I'll be seein ya around. Thanks...I guess.,,,,,,,
request_franklinworried_null_neutral,Ya say this'll help?*...Hmmm... when ya think it'll kick in?*...well I reckon I'll be seein ya around. Thanks...I guess.,,,,,,,
request_franklinworried_null_good,Ya say this'll help?*...Hmmm... when ya think it'll kick in?*...your brews tend to have a more immediate effect. Thanks...I guess.,,,,,,,
,,,,,,,,
request_franklinworried_poison_bad,"Augh, what the--?*Is this... is this POISON?*What in the darn world ya tryin' to imply with this?*I don't know why I ever decided to give you another chance.*Good riddance.",,,,,,,
request_franklinworried_poison_neutral,"Augh, what the--?*Is this... is this POISON?*What in the darn world ya tryin' to imply with this?*I don't know why I decided to trust some strange witch in the woods*Good riddance.",,,,,,,
request_franklinworried_poison_good,"Augh, what the--?*Is this... is this POISON?*What in the darn world ya tryin' to imply with this?*I reckon I was considerin' you a friend, but I guess ya just aren't cut from the right material.*Good riddance.",,,,,,,
,,,,,,,,
request_franklinworried_sleep_bad,Ahh...I'm feelin' so relaxed... so... relaxzzzzed.....zzzz*zzz...*zzz...twe...*Twenty zthreez gold piesezz....zzz...,,,,,,,
request_franklinworried_sleep_neutral,Ahh...I'm feelin' so relaxed... so... relaxzzzzed.....zzzz*zzz...*zzz...b..b...*...Berinie' ...zzz...don'tz go rushzin' inta thingz...,,,,,,,
request_franklinworried_sleep_good,Ahh...I'm feelin' so relaxed... so... relaxzzzzed.....zzzz*zzz...*zzz...b..b...*...Berinie' ...zzz...ya shouldn'tz be marryin' tha boy juzt cauze ya thinks ya should...,,,,,,,
,,,,,,,,
request_franklinworried_speed_bad,"Whoa there, what is this? I feel... I feel...*...anxious....*augh... I reckon' this ain't an issue I should've come to ya with. ",,,,,,,
request_franklinworried_speed_neutral,"Whoa there, what is this? I feel... I feel...*...anxious....*augh... I reckon' this ain't an issue I should've come to ya with. ",,,,,,,
request_franklinworried_speed_good,"Whoa there, what is this? I feel... I feel...*...anxious....*augh... I reckon' this ain't an issue I should've come to ya with.*I reckon this is one that can only be solved with honest hard work.",,,,,,,
,,,,,,,,
request_franklinworried_transformation_bad,Brrrray! (I'm a mule?)*Brrray! (I actually... feel free!)*Brrray! (mules don't gotta pay their taxes after all!),,,,,,,
request_franklinworried_transformation_neutral,Brrrray! (I'm a mule?)*Brrray! (I actually... feel free!)*Brrray! (mules don't gotta pay their taxes after all!)*Brrray! Brrray! Brray! (I'm gonna make silly mule sounds!),,,,,,,
request_franklinworried_transformation_good,Brrrray! (I'm a mule?)*Brrray! (I actually... feel free!)*Brrray! (mules don't gotta talk to their daughter's future father-in-law's)*Brray! Brrray! (what a wonderful way to spend the day),,,,,,,
default,default text for receiving stuff. This shouldn't ever be shown.,,,,,,,
wait,I reckon I'd have time to come back about the same time tomorrow... that work for ya?,,,,,,,
no,"Dangit, I was hopin' you coulda helped me out",,,,,,,
@,,,,,,,,
request_franklintired,.5,-.5,.7,-.1,-1,-1,1,-.7
request_franklinworried,.8,-.3,.8,-.1,-1,.5,-.3,.5
\Dante,,,,,,,,
dante,,,,,,,,
dante,,,,,,,,
@,,,,,,,,
intro,"You're that witch, aren't you?*Heard you were poking around these parts. *Listen, I know most of the other folks are too young to remember, but us old folks still remember what went down when your Aunt was 'round these parts. *I hope for the sake of this town you treat its people with respect.",,,,,,,
request_peaceandquiet_bad,"Listen, witch, I typically wouldn't dream of coming to you but I'm at my wit's end.*That little rascal Ralphie is driving me mad. I can't keep up with that kid.*I need you to brew me something that'll give me a bit of peace and quiet.",,,,,,,
request_peaceandquiet_neutral,"Listen, witch, I still don't trust you but I'm at my wit's end.*That little rascal Ralphie is driving me mad. I can't keep up with that kid.*I need you to brew me something that'll give me a bit of peace and quiet.",,,,,,,
request_peaceandquiet_good,"Hey maddam. Hope things are good with the... magic stuff.*Anyways I'm at my wit's end and I have to admit I need some help.*That little rascal Ralphie is driving me mad. I can't keep up with that kid.*I haven't known what to do with him, his mum was the one that minded him before... well...*Can you brew me a little something that'll give me a bit of peace and quiet?",,,,,,,
,,,,,,,,
request_peaceandquiet_healing_bad,"Hrm, well I guess I feel like I have a bit more energy now.*Better than nothing I suppose, which is what I expected.*I suppose you aren't all bad, witch.",,,,,,,
request_peaceandquiet_healing_neutral,"Hrm, well I guess I feel like I have a bit more energy now.*Better than nothing I suppose, which is what I expected.*I suppose I'll be back sometime, witch.",,,,,,,
request_peaceandquiet_healing_good,"Hrm, well I guess I feel a bit better now.*This isn't going to give me a break, though.*Better than nothing I suppose.",,,,,,,
,,,,,,,,
request_peaceandquiet_invisibility_bad,"Ah, so you've turned me invisible then. Clever.*Ralphie won't be able to bother me for a bit if he can't find me.*Should give me enough time for a proper nap.*Thanks, witch, I suppose I might have judged you too harshly before.",,,,,,,
request_peaceandquiet_invisibility_neutral,"Ah, so you've turned me invisible then. Clever.*Ralphie won't be able to bother me for a bit if he can't find me.*Should give me enough time for a proper nap.*Thanks, witch, I suppose I'll be back sometime with another problem.",,,,,,,
request_peaceandquiet_invisibility_good,"Ah, so you've turned me invisible then. Clever.*Ralphie won't be able to bother me for a bit if he can't find me.*Should give me enough time for a proper nap.*Thanks, wtich, you've done another good deed for an old man.",,,,,,,
,,,,,,,,
request_peaceandquiet_mana_bad,"Hmmm, I suppose I feel a fair bit stronger than before.*Maybe this'll give me a bit of oomph to get through the day.*Better than nothing, I suppose. ",,,,,,,
request_peaceandquiet_mana_neutral,"Hmm, I suppose I feel a fair bit stronger than before.*Maybe this'll give me a bit more oomph to get through the day.*It's something, witch. Thanks, I suppose.",,,,,,,
request_peaceandquiet_mana_good,"Hmmm, I suppose I feel a bit stronger than before.*Maybe this'll give me a bit more oomph to get through the day.*Thanks, witch, you did your best.",,,,,,,
,,,,,,,,
request_peaceandquiet_null_bad,"Hmmph, does nothing, I suppose.*I shouldn't have expected you to ever be helpful, witch.",,,,,,,
request_peaceandquiet_null_neutral,"Hmmmph, I don't feel any different.*Are you telling me I should deal with my problems myself?*You didn't need to be so passive-agressive about it.",,,,,,,
request_peaceandquiet_null_good,"Hmmmph, I'm not sure this did anything at all.*Are you trying to tell me I should deal with my problems myself?*You didn't need to be so passive-agressive about it.",,,,,,,
,,,,,,,,
request_peaceandquiet_poison_bad,Bleech... you horrid witch. *An afternoon hunched over the toilet is not the type of peace and quiet I had in mind.,,,,,,,
request_peaceandquiet_poison_neutral,Bleech... this is horrible.*An afternoon hunched over the toilet is not the type of peace and quiet I had in mind.,,,,,,,
request_peaceandquiet_poison_good,Bleech...this tastes disgusting. I feel sick to my stomach.*An afternoon hunched over the toilet is not the type of peace and quiet I had in mind.,,,,,,,
,,,,,,,,
request_peaceandquiet_sleep_bad,"Ahhh, maybe a nap is just what I need.*This'll give me a good break from dealing with that kid.*Thanks, witch, perhaps I misjudged you before.",,,,,,,
request_peaceandquiet_sleep_neutral,"Ahhh, maybe a nap is just what I need.*This'll give me a good break from dealing with that kid.*Thanks, witch, I suppose I'll be back again sometime.",,,,,,,
request_peaceandquiet_sleep_good,"Ahhh, maybe a nap is just what I need.*Honestly, it's been a huge trouble managing Ralphie ever since his mum died.*A good sleep will probably clear my mind and let me think on this more clearly.*Thanks, witch, I'll be back again sometime soon.",,,,,,,
,,,,,,,,
request_peaceandquiet_speed_bad,"Augh, my head! What have you done to me?*My mind is racing with everything I'm not doing for my son.*I hate this, I hate this so much. How could you?",,,,,,,
request_peaceandquiet_speed_neutral,"Augh, my head! What have you done to me?*My mind is racing.*I'm a horrible father.*I'm not spending enough time with my son.*I have never and will never understand him.*I hate this, I hate this so much.",,,,,,,
request_peaceandquiet_speed_good,"Augh, my head! What is this awful brew?*My mind is racing.*I'm a horrible father.*I'm not spending enough time with my son.*I don't know how to connect with him now that his mum is gone.*I hate this. I hate this so much.",,,,,,,
,,,,,,,,
request_peaceandquiet_transformation_bad,"Hoot! Hoo!*(This is perfect)*Hooot hoot hoot!*(I can have a nice nap perched on a branch somewhere)*Hoot hoot*(Thanks for once, witch)",,,,,,,
request_peaceandquiet_transformation_neutral,"Hoot! Hoo!*(This is perfect)*Hooot hoot hoot!*(I can have a nice nap perched on a branch somewhere)*Hoot hoot*(Thanks I suppose, witch)",,,,,,,
request_peaceandquiet_transformation_good,"Hoot! Hoo!*(This is perfect)*Hooot hoot hoot!*(I can have a nice nap perched on a branch somewhere)*Hoot hoot*(Thanks for another good one, witch)",,,,,,,
,,,,,,,,
default,default text for receiving stuff. This shouldn't ever be shown.,,,,,,,
wait,I can come collect the potion tomorrow.,,,,,,,
no,"Fine, I didn't really want your help anyways.",,,,,,,
@,,,,,,,,
request_peaceandquiet,.2,1,.2,-.2,-1,.7,-.5,-.5